label,sublabel,description,styles,bgcolor
普通ごみ,,・ふた付きポリ容器または透明・半透明の袋で、収集当日の朝8時までに出してください。（指定袋はありません）<BR>・収集後・夜間は、ごみを出さないでください。,,#ea3b13
空き缶・ペットボトル,,・透明・半透明の袋に一緒に入れて出してください。（収集後、資源化処理施設で選別し、リサイクルしています。）<BR>・対象となる空き缶は、飲料缶、菓子缶、粉ミルク缶などの食品の缶や、スプレー缶などです。（注意）家庭から出る一斗缶は粗大ごみとして収集します。<BR>・ペットボトルは、PETマークのある「飲料、酒、みりん類、しょうゆ、酢」などの容器です。（注意）ソースや食用油が入っていたペットボトルは、汚れがひどいため、普通ごみに出してください。,,#81d12e
空きびん,,・キャップを外し、中を洗ってから袋に入れずに、「びん」のみを「空きびん入れ」に入れてください。<BR>・対象となる空きびんは、飲料びん・調味料びんなどの食品のびんです。<BR>・空きびんとして出してはいけないガラス類：<BR>割れたびん、陶器、コップ、哺乳瓶、化粧品のびん；<BR>→厚紙に包み「ワレモノキケン」などと書いて普通ごみとして出してください。<BR>・金属製のキャップは「空き缶」として出してください。<BR>・プラスチック製のキャップとラベルは「プラスチック製容器包装」として出してください。<BR>・一升びん、ビールびんなどのリターナブル(繰り返し使用できる)びんは、できるだけ購入店や販売店に返すか地域の資源集団回収に出してください。<BR>,img/bin02.svg,#2dc7aa
使用済み乾電池,,・透明の袋に入れて「資源物集積所」に出してください。<BR>・（注意）市で収集するものは、積層型・筒型乾電池・リチウムコイン乾電池（型式記号CR及びBR）のみです。<BR>・ボタン型電池は「市で収集しないもの」です。電気店・時計店などに置いてある「ボタン電池回収缶」に入れてください。<BR>・充電式電池は「市で収集しないもの」です。ニカド電池などの使用済み充電式電池（小型二次電池）は「リサイクル協力店」に加入の販売店などに置いてあるリサイクルBOXに入れてください。,,#27a047
ミックスペーパー,,・ミックスペーパーとは、紙マークがついているもののほか、お菓子の箱、投げ込みチラシ、パンフレット、包装紙、（窓付き）封筒、ハガキ、写真、ノート、メモ帳、シュレッダー紙、プラスチックコート紙や合成紙、レシート・伝票等の裏カーボン紙（ホチキス針がついたままでもOKです。）<BR>・「紙袋に入れる」または「ひもでむすぶ」のいずれかの方法で、収集当日の朝8時までに「資源物集積所」に出してください。（収集後、資源化処理施設で選別・異物除去し、再生工場でトイレットペーパーに生まれ変わります。）<BR>・ポリ袋（レジ袋）や段ボール箱では出さないでください。<BR>・ミックスペーパーとして出してはいけない紙類：<BR>・・汚れた紙・臭いの強い紙→普通ごみに出してください。<BR>・・新聞紙・雑誌・段ボール・牛乳パック等→資源集団回収・店頭回収などに出してください。<BR>・資源集団回収とは、町内会・自治会、PTA等地域の市民で組織される実施団体が各家庭の協力により、新聞・雑誌・段ボール、古着等の資源化物を回収して資源回収業者に引き渡すことをいいます。ごみの減量化・リサイクルのために資源集団回収に積極的に参加しましょう。<BR>・資源集団回収は、実施団体ごとに回収場所や回収日等が違います。お住まいの地域での実施状況については、住所から実施団体や回収場所等をお調べすることができますので、お手数ですが所管の生活環境事業所へ御連絡ください。<BR>http://www.city.kawasaki.jp/kurashi/category/24-1-13-1-0-0-0-0-0-0.html,,#d2691e
プラスチック製容器包装,,・プラスチック製容器包装(プラ容器)とは、生鮮食品のトレイ、カップめんの容器、シャンプーボトル、お菓子などの袋、プラスチック素材でできた容器や包装のことです。<BR>・中身を使い切って、軽くすすぐか、汚れをふき取ってきれいにしてから、中身の見える透明・半透明の袋に入れて、収集当日の朝8時までに「資源物集積所」に出してください。<BR>・プラスチック製容器包装として出してはいけないもの：プラスチック製のおもちゃや文房具などの製品そのものは、「普通ごみ」として出してください。<BR>・『プラスチック製容器包装（プラ容器）』の法的根拠：<BR>容器包装リサイクル法（「容器包装に係る分別収集及び再商品化の促進等に関する法律」。以下「容リ法」）で対象とされた「容器包装」 です。<BR>　容リ法でいう「容器包装」 とは、商品を入れる「容器」及び商品を包む「包装」（商品の容器及び包装自体が有償である場合を含む）であり、商品を消費したり商品と分離した場合に不要となるものです（法第2条第1項参照）。<BR>・参照　<BR>http://www.city.kawasaki.jp/300/page/0000051612.html<BR>http://www.city.kawasaki.jp/300/page/0000038169.html,,#77ae1f
小物金属,,・30cm未満の金属製品・かさ・針金ハンガーなど<BR>・袋に入れず、そのままの状態で（散乱しやすいものは、ひもまたはテープで束ねて）「資源物集積所」に収集当日の朝8時までに出してください。<BR>※くぎ、ネジなどの小さなものは、透明の袋に入れて出してください。<BR>・なべ、フライパン、やかん等の調理用品は「柄、取っ手、注ぎ口」含まずに長さを測り、30cmに満たないものは小物金属として収集します。<BR>・包丁などの刃物は、厚紙で包み「包丁キケン」などと表示<BR>・ラジオ　懐中電灯などは、乾電池を取りはずす（乾電池は資源物へ）<BR>電気スタンドなどは、電球を取りはずす（電球は普通ごみへ）<BR>・はさみなどは、厚紙で包み「はさみキケン」などと表示<BR>・最長辺が30cmを超えるものは「粗大ごみ」として出してください。,,#999999
粗大ごみ,,・事前に申込みが必要です。粗大ごみ処理手数料がかかります。<BR>・申込みは粗大ごみ受付センターへ（044-930-5300）<BR>受付日時　月～土（日曜、12月31日～1月3日を除く）、午前8時～午後4時45分,,#685ecf
